{
  "schemaVersion": "1.0", "recipeId": "editorial-content", "productScenario": "Sourced implementation guide",
  "differenceExplanation": ["Good hierarchy binds section heading → guide navigation → source context → reading continuation; bad composition exposes a disconnected action.", "Good states keep section and provenance context through recovery; bad states replace the guide with generic placeholders.", "Good mobile scenes preserve reading position and next section; bad scenes lose the document hierarchy."],
  "scenes": [
    {"id":"good-desktop-success","quality":"good","viewport":"desktop","state":"success","title":"section","primaryAction":"Continue reading","blocks":[{"kind":"heading","label":"Current section","emphasis":3},{"kind":"list","label":"Guide navigation","emphasis":2},{"kind":"copy","label":"Source context","emphasis":2},{"kind":"action","label":"Continue reading","emphasis":2}],"appliedRuleIds":["typography.role-contrast","layout.action-evidence","responsive.recompose-not-stack","color.semantic-roles","state.complete-primary-flow","signature.product-data-grammar"],"violatedRuleIds":[],"asset":"assets/good-desktop-success.svg"},
    {"id":"bad-desktop-success","quality":"bad","viewport":"desktop","state":"success","title":"section","primaryAction":"Continue reading","blocks":[{"kind":"action","label":"Continue reading","emphasis":3},{"kind":"copy","label":"section","emphasis":1}],"appliedRuleIds":[],"violatedRuleIds":["typography.role-contrast","layout.action-evidence","signature.product-data-grammar"],"asset":"assets/bad-desktop-success.svg"},
    {"id":"good-mobile-success","quality":"good","viewport":"mobile","state":"success","title":"section","primaryAction":"Continue reading","blocks":[{"kind":"heading","label":"Current section","emphasis":3},{"kind":"list","label":"Guide navigation","emphasis":2},{"kind":"copy","label":"Source context","emphasis":2},{"kind":"action","label":"Continue reading","emphasis":2}],"appliedRuleIds":["typography.role-contrast","layout.action-evidence","responsive.recompose-not-stack","color.semantic-roles","state.complete-primary-flow","signature.product-data-grammar"],"violatedRuleIds":[],"asset":"assets/good-mobile-success.svg"},
    {"id":"bad-mobile-success","quality":"bad","viewport":"mobile","state":"success","title":"section","primaryAction":"Continue reading","blocks":[{"kind":"copy","label":"section","emphasis":1},{"kind":"action","label":"Continue reading","emphasis":1}],"appliedRuleIds":[],"violatedRuleIds":["responsive.recompose-not-stack","layout.action-evidence","typography.role-contrast"],"asset":"assets/bad-mobile-success.svg"},
    {"id":"good-mobile-loading","quality":"good","viewport":"mobile","state":"loading","title":"Loading","primaryAction":"Continue reading","blocks":[{"kind":"status","label":"Loading","emphasis":3},{"kind":"list","label":"Guide navigation","emphasis":2}],"appliedRuleIds":["typography.role-contrast","layout.action-evidence","responsive.recompose-not-stack","color.semantic-roles","state.complete-primary-flow","signature.product-data-grammar"],"violatedRuleIds":[],"asset":"assets/good-mobile-loading.svg"},
    {"id":"bad-mobile-loading","quality":"bad","viewport":"mobile","state":"loading","title":"Loading","primaryAction":"Continue reading","blocks":[{"kind":"copy","label":"Loading","emphasis":1}],"appliedRuleIds":[],"violatedRuleIds":["state.complete-primary-flow","layout.action-evidence","typography.role-contrast"],"asset":"assets/bad-mobile-loading.svg"},
    {"id":"good-mobile-empty","quality":"good","viewport":"mobile","state":"empty","title":"Nothing here yet","primaryAction":"Continue reading","blocks":[{"kind":"heading","label":"Nothing here yet","emphasis":3},{"kind":"action","label":"Continue reading","emphasis":2}],"appliedRuleIds":["typography.role-contrast","layout.action-evidence","responsive.recompose-not-stack","color.semantic-roles","state.complete-primary-flow","signature.product-data-grammar"],"violatedRuleIds":[],"asset":"assets/good-mobile-empty.svg"},
    {"id":"bad-mobile-empty","quality":"bad","viewport":"mobile","state":"empty","title":"Nothing here yet","primaryAction":"Continue reading","blocks":[{"kind":"copy","label":"Nothing here yet","emphasis":1}],"appliedRuleIds":[],"violatedRuleIds":["state.complete-primary-flow","layout.action-evidence","responsive.recompose-not-stack"],"asset":"assets/bad-mobile-empty.svg"},
    {"id":"good-mobile-error","quality":"good","viewport":"mobile","state":"error","title":"Try again","primaryAction":"Try again","blocks":[{"kind":"status","label":"Unavailable","emphasis":3},{"kind":"copy","label":"Source context","emphasis":2},{"kind":"action","label":"Try again","emphasis":2}],"appliedRuleIds":["typography.role-contrast","layout.action-evidence","responsive.recompose-not-stack","color.semantic-roles","state.complete-primary-flow","signature.product-data-grammar"],"violatedRuleIds":[],"asset":"assets/good-mobile-error.svg"},
    {"id":"bad-mobile-error","quality":"bad","viewport":"mobile","state":"error","title":"Try again","primaryAction":"Try again","blocks":[{"kind":"copy","label":"Unavailable","emphasis":1}],"appliedRuleIds":[],"violatedRuleIds":["state.complete-primary-flow","color.semantic-roles","layout.action-evidence"],"asset":"assets/bad-mobile-error.svg"}
  ]
}
