{
  "schemaVersion": "1.0", "recipeId": "marketing-landing", "productScenario": "Product capability explanation with supplied proof slot",
  "differenceExplanation": ["Good hierarchy follows capability, supplied proof, and request action; bad composition promotes an action without mechanism or evidence.", "Good states preserve the capability context and recovery through semantic roles; bad states substitute generic campaign messaging.", "Good mobile scenes keep each capability-proof pair intact; bad scenes mechanically stack desktop sections."],
  "scenes": [
    {"id":"good-desktop-success","quality":"good","viewport":"desktop","state":"success","title":"capability","primaryAction":"Request access","blocks":[{"kind":"heading","label":"capability","emphasis":3},{"kind":"copy","label":"capability","emphasis":2},{"kind":"action","label":"Request access","emphasis":2}],"appliedRuleIds":["typography.role-contrast","layout.action-evidence","responsive.recompose-not-stack","color.semantic-roles","state.complete-primary-flow","signature.product-data-grammar"],"violatedRuleIds":[],"asset":"assets/good-desktop-success.svg"},
    {"id":"bad-desktop-success","quality":"bad","viewport":"desktop","state":"success","title":"capability","primaryAction":"Request access","blocks":[{"kind":"action","label":"Request access","emphasis":3},{"kind":"copy","label":"capability","emphasis":1}],"appliedRuleIds":[],"violatedRuleIds":["typography.role-contrast","layout.action-evidence","signature.product-data-grammar"],"asset":"assets/bad-desktop-success.svg"},
    {"id":"good-mobile-success","quality":"good","viewport":"mobile","state":"success","title":"capability","primaryAction":"Request access","blocks":[{"kind":"heading","label":"capability","emphasis":3},{"kind":"action","label":"Request access","emphasis":2}],"appliedRuleIds":["typography.role-contrast","layout.action-evidence","responsive.recompose-not-stack","color.semantic-roles","state.complete-primary-flow","signature.product-data-grammar"],"violatedRuleIds":[],"asset":"assets/good-mobile-success.svg"},
    {"id":"bad-mobile-success","quality":"bad","viewport":"mobile","state":"success","title":"capability","primaryAction":"Request access","blocks":[{"kind":"copy","label":"capability","emphasis":1},{"kind":"action","label":"Request access","emphasis":1}],"appliedRuleIds":[],"violatedRuleIds":["responsive.recompose-not-stack","layout.action-evidence","typography.role-contrast"],"asset":"assets/bad-mobile-success.svg"},
    {"id":"good-mobile-loading","quality":"good","viewport":"mobile","state":"loading","title":"Loading","primaryAction":"Request access","blocks":[{"kind":"status","label":"Loading","emphasis":3},{"kind":"copy","label":"capability","emphasis":2}],"appliedRuleIds":["typography.role-contrast","layout.action-evidence","responsive.recompose-not-stack","color.semantic-roles","state.complete-primary-flow","signature.product-data-grammar"],"violatedRuleIds":[],"asset":"assets/good-mobile-loading.svg"},
    {"id":"bad-mobile-loading","quality":"bad","viewport":"mobile","state":"loading","title":"Loading","primaryAction":"Request access","blocks":[{"kind":"copy","label":"Loading","emphasis":1}],"appliedRuleIds":[],"violatedRuleIds":["state.complete-primary-flow","layout.action-evidence","typography.role-contrast"],"asset":"assets/bad-mobile-loading.svg"},
    {"id":"good-mobile-empty","quality":"good","viewport":"mobile","state":"empty","title":"Nothing here yet","primaryAction":"Request access","blocks":[{"kind":"heading","label":"Nothing here yet","emphasis":3},{"kind":"action","label":"Request access","emphasis":2}],"appliedRuleIds":["typography.role-contrast","layout.action-evidence","responsive.recompose-not-stack","color.semantic-roles","state.complete-primary-flow","signature.product-data-grammar"],"violatedRuleIds":[],"asset":"assets/good-mobile-empty.svg"},
    {"id":"bad-mobile-empty","quality":"bad","viewport":"mobile","state":"empty","title":"Nothing here yet","primaryAction":"Request access","blocks":[{"kind":"copy","label":"Nothing here yet","emphasis":1}],"appliedRuleIds":[],"violatedRuleIds":["state.complete-primary-flow","layout.action-evidence","responsive.recompose-not-stack"],"asset":"assets/bad-mobile-empty.svg"},
    {"id":"good-mobile-error","quality":"good","viewport":"mobile","state":"error","title":"Try again","primaryAction":"Try again","blocks":[{"kind":"status","label":"Unavailable","emphasis":3},{"kind":"action","label":"Try again","emphasis":2}],"appliedRuleIds":["typography.role-contrast","layout.action-evidence","responsive.recompose-not-stack","color.semantic-roles","state.complete-primary-flow","signature.product-data-grammar"],"violatedRuleIds":[],"asset":"assets/good-mobile-error.svg"},
    {"id":"bad-mobile-error","quality":"bad","viewport":"mobile","state":"error","title":"Try again","primaryAction":"Try again","blocks":[{"kind":"copy","label":"Unavailable","emphasis":1}],"appliedRuleIds":[],"violatedRuleIds":["state.complete-primary-flow","color.semantic-roles","layout.action-evidence"],"asset":"assets/bad-mobile-error.svg"}
  ]
}
