{
  "schemaVersion": "1.0", "recipeId": "saas-workspace", "productScenario": "Team project task list with permissions",
  "differenceExplanation": ["Good hierarchy binds the task lifecycle, permission state, and update action; bad composition replaces decisions with generic workspace containers.", "Good states preserve the task and recovery through semantic roles; bad states hide permission and sync meaning.", "Good mobile scenes turn list-detail work into a task-first drill-in; bad scenes shrink desktop navigation."],
  "scenes": [
    {"id":"good-desktop-success","quality":"good","viewport":"desktop","state":"success","title":"task","primaryAction":"Update status","blocks":[{"kind":"heading","label":"task","emphasis":3},{"kind":"status","label":"Permission required","emphasis":2},{"kind":"action","label":"Update status","emphasis":2}],"appliedRuleIds":["typography.role-contrast","layout.action-evidence","responsive.recompose-not-stack","color.semantic-roles","state.complete-primary-flow","signature.product-data-grammar"],"violatedRuleIds":[],"asset":"assets/good-desktop-success.svg"},
    {"id":"bad-desktop-success","quality":"bad","viewport":"desktop","state":"success","title":"task","primaryAction":"Update status","blocks":[{"kind":"action","label":"Update status","emphasis":3},{"kind":"copy","label":"task","emphasis":1}],"appliedRuleIds":[],"violatedRuleIds":["typography.role-contrast","layout.action-evidence","signature.product-data-grammar"],"asset":"assets/bad-desktop-success.svg"},
    {"id":"good-mobile-success","quality":"good","viewport":"mobile","state":"success","title":"task","primaryAction":"Update status","blocks":[{"kind":"status","label":"task","emphasis":3},{"kind":"action","label":"Update status","emphasis":2}],"appliedRuleIds":["typography.role-contrast","layout.action-evidence","responsive.recompose-not-stack","color.semantic-roles","state.complete-primary-flow","signature.product-data-grammar"],"violatedRuleIds":[],"asset":"assets/good-mobile-success.svg"},
    {"id":"bad-mobile-success","quality":"bad","viewport":"mobile","state":"success","title":"task","primaryAction":"Update status","blocks":[{"kind":"copy","label":"task","emphasis":1},{"kind":"action","label":"Update status","emphasis":1}],"appliedRuleIds":[],"violatedRuleIds":["responsive.recompose-not-stack","layout.action-evidence","typography.role-contrast"],"asset":"assets/bad-mobile-success.svg"},
    {"id":"good-mobile-loading","quality":"good","viewport":"mobile","state":"loading","title":"Loading","primaryAction":"Update status","blocks":[{"kind":"status","label":"Loading","emphasis":3},{"kind":"list","label":"task","emphasis":2}],"appliedRuleIds":["typography.role-contrast","layout.action-evidence","responsive.recompose-not-stack","color.semantic-roles","state.complete-primary-flow","signature.product-data-grammar"],"violatedRuleIds":[],"asset":"assets/good-mobile-loading.svg"},
    {"id":"bad-mobile-loading","quality":"bad","viewport":"mobile","state":"loading","title":"Loading","primaryAction":"Update status","blocks":[{"kind":"copy","label":"Loading","emphasis":1}],"appliedRuleIds":[],"violatedRuleIds":["state.complete-primary-flow","layout.action-evidence","typography.role-contrast"],"asset":"assets/bad-mobile-loading.svg"},
    {"id":"good-mobile-empty","quality":"good","viewport":"mobile","state":"empty","title":"Nothing here yet","primaryAction":"Update status","blocks":[{"kind":"heading","label":"Nothing here yet","emphasis":3},{"kind":"action","label":"Update status","emphasis":2}],"appliedRuleIds":["typography.role-contrast","layout.action-evidence","responsive.recompose-not-stack","color.semantic-roles","state.complete-primary-flow","signature.product-data-grammar"],"violatedRuleIds":[],"asset":"assets/good-mobile-empty.svg"},
    {"id":"bad-mobile-empty","quality":"bad","viewport":"mobile","state":"empty","title":"Nothing here yet","primaryAction":"Update status","blocks":[{"kind":"copy","label":"Nothing here yet","emphasis":1}],"appliedRuleIds":[],"violatedRuleIds":["state.complete-primary-flow","layout.action-evidence","responsive.recompose-not-stack"],"asset":"assets/bad-mobile-empty.svg"},
    {"id":"good-mobile-error","quality":"good","viewport":"mobile","state":"error","title":"Try again","primaryAction":"Try again","blocks":[{"kind":"status","label":"Permission required","emphasis":3},{"kind":"action","label":"Try again","emphasis":2}],"appliedRuleIds":["typography.role-contrast","layout.action-evidence","responsive.recompose-not-stack","color.semantic-roles","state.complete-primary-flow","signature.product-data-grammar"],"violatedRuleIds":[],"asset":"assets/good-mobile-error.svg"},
    {"id":"bad-mobile-error","quality":"bad","viewport":"mobile","state":"error","title":"Try again","primaryAction":"Try again","blocks":[{"kind":"copy","label":"Permission required","emphasis":1}],"appliedRuleIds":[],"violatedRuleIds":["state.complete-primary-flow","color.semantic-roles","layout.action-evidence"],"asset":"assets/bad-mobile-error.svg"}
  ]
}
