{
  "schemaVersion": "1.0", "recipeId": "consumer-discovery", "productScenario": "Saved reading catalogue with filters",
  "differenceExplanation": ["Good hierarchy makes each title and save action legible as one decision; bad composition repeats undifferentiated containers.", "Good states keep catalogue meaning and recovery visible through semantic roles; bad states replace the primary object with generic messaging.", "Good mobile scenes preserve the title-first sequence and one-thumb action; bad scenes squeeze the desktop grid."],
  "scenes": [
    {"id":"good-desktop-success","quality":"good","viewport":"desktop","state":"success","title":"title","primaryAction":"Save title","blocks":[{"kind":"media","label":"title","emphasis":3},{"kind":"action","label":"Save title","emphasis":2}],"appliedRuleIds":["typography.role-contrast","layout.action-evidence","responsive.recompose-not-stack","color.semantic-roles","state.complete-primary-flow","signature.product-data-grammar"],"violatedRuleIds":[],"asset":"assets/good-desktop-success.svg"},
    {"id":"bad-desktop-success","quality":"bad","viewport":"desktop","state":"success","title":"title","primaryAction":"Save title","blocks":[{"kind":"action","label":"Save title","emphasis":3},{"kind":"copy","label":"title","emphasis":1}],"appliedRuleIds":[],"violatedRuleIds":["typography.role-contrast","layout.action-evidence","signature.product-data-grammar"],"asset":"assets/bad-desktop-success.svg"},
    {"id":"good-mobile-success","quality":"good","viewport":"mobile","state":"success","title":"title","primaryAction":"Save title","blocks":[{"kind":"heading","label":"title","emphasis":3},{"kind":"action","label":"Save title","emphasis":2}],"appliedRuleIds":["typography.role-contrast","layout.action-evidence","responsive.recompose-not-stack","color.semantic-roles","state.complete-primary-flow","signature.product-data-grammar"],"violatedRuleIds":[],"asset":"assets/good-mobile-success.svg"},
    {"id":"bad-mobile-success","quality":"bad","viewport":"mobile","state":"success","title":"title","primaryAction":"Save title","blocks":[{"kind":"copy","label":"title","emphasis":1},{"kind":"action","label":"Save title","emphasis":1}],"appliedRuleIds":[],"violatedRuleIds":["responsive.recompose-not-stack","layout.action-evidence","typography.role-contrast"],"asset":"assets/bad-mobile-success.svg"},
    {"id":"good-mobile-loading","quality":"good","viewport":"mobile","state":"loading","title":"Loading","primaryAction":"Save title","blocks":[{"kind":"status","label":"Loading","emphasis":3},{"kind":"media","label":"title","emphasis":2}],"appliedRuleIds":["typography.role-contrast","layout.action-evidence","responsive.recompose-not-stack","color.semantic-roles","state.complete-primary-flow","signature.product-data-grammar"],"violatedRuleIds":[],"asset":"assets/good-mobile-loading.svg"},
    {"id":"bad-mobile-loading","quality":"bad","viewport":"mobile","state":"loading","title":"Loading","primaryAction":"Save title","blocks":[{"kind":"copy","label":"Loading","emphasis":1}],"appliedRuleIds":[],"violatedRuleIds":["state.complete-primary-flow","layout.action-evidence","typography.role-contrast"],"asset":"assets/bad-mobile-loading.svg"},
    {"id":"good-mobile-empty","quality":"good","viewport":"mobile","state":"empty","title":"Nothing here yet","primaryAction":"Save title","blocks":[{"kind":"heading","label":"Nothing here yet","emphasis":3},{"kind":"action","label":"Save title","emphasis":2}],"appliedRuleIds":["typography.role-contrast","layout.action-evidence","responsive.recompose-not-stack","color.semantic-roles","state.complete-primary-flow","signature.product-data-grammar"],"violatedRuleIds":[],"asset":"assets/good-mobile-empty.svg"},
    {"id":"bad-mobile-empty","quality":"bad","viewport":"mobile","state":"empty","title":"Nothing here yet","primaryAction":"Save title","blocks":[{"kind":"copy","label":"Nothing here yet","emphasis":1}],"appliedRuleIds":[],"violatedRuleIds":["state.complete-primary-flow","layout.action-evidence","responsive.recompose-not-stack"],"asset":"assets/bad-mobile-empty.svg"},
    {"id":"good-mobile-error","quality":"good","viewport":"mobile","state":"error","title":"Try again","primaryAction":"Try again","blocks":[{"kind":"status","label":"Unavailable","emphasis":3},{"kind":"action","label":"Try again","emphasis":2}],"appliedRuleIds":["typography.role-contrast","layout.action-evidence","responsive.recompose-not-stack","color.semantic-roles","state.complete-primary-flow","signature.product-data-grammar"],"violatedRuleIds":[],"asset":"assets/good-mobile-error.svg"},
    {"id":"bad-mobile-error","quality":"bad","viewport":"mobile","state":"error","title":"Try again","primaryAction":"Try again","blocks":[{"kind":"copy","label":"Unavailable","emphasis":1}],"appliedRuleIds":[],"violatedRuleIds":["state.complete-primary-flow","color.semantic-roles","layout.action-evidence"],"asset":"assets/bad-mobile-error.svg"}
  ]
}
