{
  "schemaVersion": "1.0", "recipeId": "developer-tool", "productScenario": "Repository run diagnostics",
  "differenceExplanation": ["Good hierarchy shows system action → failed state → diagnostic evidence → recovery; bad composition exposes a generic action without causal context.", "Good states preserve the affected run and explicit recovery; bad states collapse failures into generic copy.", "Good mobile scenes keep the failed step, log evidence, and retry path together; bad scenes lose the diagnostic relation."],
  "scenes": [
    {"id":"good-desktop-success","quality":"good","viewport":"desktop","state":"success","title":"run","primaryAction":"Inspect failure","blocks":[{"kind":"action","label":"Run command","emphasis":2},{"kind":"status","label":"Failed step","emphasis":3},{"kind":"list","label":"Log evidence","emphasis":2},{"kind":"action","label":"Retry run","emphasis":2}],"appliedRuleIds":["typography.role-contrast","layout.action-evidence","responsive.recompose-not-stack","color.semantic-roles","state.complete-primary-flow","signature.product-data-grammar"],"violatedRuleIds":[],"asset":"assets/good-desktop-success.svg"},
    {"id":"bad-desktop-success","quality":"bad","viewport":"desktop","state":"success","title":"run","primaryAction":"Inspect failure","blocks":[{"kind":"action","label":"Inspect failure","emphasis":3},{"kind":"copy","label":"run","emphasis":1}],"appliedRuleIds":[],"violatedRuleIds":["typography.role-contrast","layout.action-evidence","signature.product-data-grammar"],"asset":"assets/bad-desktop-success.svg"},
    {"id":"good-mobile-success","quality":"good","viewport":"mobile","state":"success","title":"run","primaryAction":"Inspect failure","blocks":[{"kind":"status","label":"Failed step","emphasis":3},{"kind":"list","label":"Log evidence","emphasis":2},{"kind":"action","label":"Retry run","emphasis":2}],"appliedRuleIds":["typography.role-contrast","layout.action-evidence","responsive.recompose-not-stack","color.semantic-roles","state.complete-primary-flow","signature.product-data-grammar"],"violatedRuleIds":[],"asset":"assets/good-mobile-success.svg"},
    {"id":"bad-mobile-success","quality":"bad","viewport":"mobile","state":"success","title":"run","primaryAction":"Inspect failure","blocks":[{"kind":"copy","label":"run","emphasis":1},{"kind":"action","label":"Inspect failure","emphasis":1}],"appliedRuleIds":[],"violatedRuleIds":["responsive.recompose-not-stack","layout.action-evidence","typography.role-contrast"],"asset":"assets/bad-mobile-success.svg"},
    {"id":"good-mobile-loading","quality":"good","viewport":"mobile","state":"loading","title":"Loading","primaryAction":"Inspect failure","blocks":[{"kind":"status","label":"Loading","emphasis":3},{"kind":"list","label":"run","emphasis":2}],"appliedRuleIds":["typography.role-contrast","layout.action-evidence","responsive.recompose-not-stack","color.semantic-roles","state.complete-primary-flow","signature.product-data-grammar"],"violatedRuleIds":[],"asset":"assets/good-mobile-loading.svg"},
    {"id":"bad-mobile-loading","quality":"bad","viewport":"mobile","state":"loading","title":"Loading","primaryAction":"Inspect failure","blocks":[{"kind":"copy","label":"Loading","emphasis":1}],"appliedRuleIds":[],"violatedRuleIds":["state.complete-primary-flow","layout.action-evidence","typography.role-contrast"],"asset":"assets/bad-mobile-loading.svg"},
    {"id":"good-mobile-empty","quality":"good","viewport":"mobile","state":"empty","title":"Nothing here yet","primaryAction":"Inspect failure","blocks":[{"kind":"heading","label":"Nothing here yet","emphasis":3},{"kind":"action","label":"Inspect failure","emphasis":2}],"appliedRuleIds":["typography.role-contrast","layout.action-evidence","responsive.recompose-not-stack","color.semantic-roles","state.complete-primary-flow","signature.product-data-grammar"],"violatedRuleIds":[],"asset":"assets/good-mobile-empty.svg"},
    {"id":"bad-mobile-empty","quality":"bad","viewport":"mobile","state":"empty","title":"Nothing here yet","primaryAction":"Inspect failure","blocks":[{"kind":"copy","label":"Nothing here yet","emphasis":1}],"appliedRuleIds":[],"violatedRuleIds":["state.complete-primary-flow","layout.action-evidence","responsive.recompose-not-stack"],"asset":"assets/bad-mobile-empty.svg"},
    {"id":"good-mobile-error","quality":"good","viewport":"mobile","state":"error","title":"Try again","primaryAction":"Try again","blocks":[{"kind":"status","label":"Failed step","emphasis":3},{"kind":"list","label":"Log evidence","emphasis":2},{"kind":"action","label":"Retry run","emphasis":2}],"appliedRuleIds":["typography.role-contrast","layout.action-evidence","responsive.recompose-not-stack","color.semantic-roles","state.complete-primary-flow","signature.product-data-grammar"],"violatedRuleIds":[],"asset":"assets/good-mobile-error.svg"},
    {"id":"bad-mobile-error","quality":"bad","viewport":"mobile","state":"error","title":"Try again","primaryAction":"Try again","blocks":[{"kind":"copy","label":"Unavailable","emphasis":1}],"appliedRuleIds":[],"violatedRuleIds":["state.complete-primary-flow","color.semantic-roles","layout.action-evidence"],"asset":"assets/bad-mobile-error.svg"}
  ]
}
