{
  "schemaVersion": "1.0", "recipeId": "mobile-consumer-app", "productScenario": "Daily habit check-in with offline recovery",
  "differenceExplanation": ["Good hierarchy centers the check-in and its completion feedback; bad composition gives equal weight to unrelated regions.", "Good states distinguish completion, offline, and retry through semantic roles; bad states silently lose the repeated action.", "Good mobile scenes place the repeated action in a reachable sequence; bad scenes reproduce desktop navigation and gesture assumptions."],
  "scenes": [
    {"id":"good-desktop-success","quality":"good","viewport":"desktop","state":"success","title":"check-in","primaryAction":"Mark complete","blocks":[{"kind":"heading","label":"check-in","emphasis":3},{"kind":"status","label":"Offline","emphasis":2},{"kind":"action","label":"Mark complete","emphasis":2}],"appliedRuleIds":["typography.role-contrast","layout.action-evidence","responsive.recompose-not-stack","color.semantic-roles","state.complete-primary-flow","signature.product-data-grammar"],"violatedRuleIds":[],"asset":"assets/good-desktop-success.svg"},
    {"id":"bad-desktop-success","quality":"bad","viewport":"desktop","state":"success","title":"check-in","primaryAction":"Mark complete","blocks":[{"kind":"action","label":"Mark complete","emphasis":3},{"kind":"copy","label":"check-in","emphasis":1}],"appliedRuleIds":[],"violatedRuleIds":["typography.role-contrast","layout.action-evidence","signature.repeated-action-feedback"],"asset":"assets/bad-desktop-success.svg"},
    {"id":"good-mobile-success","quality":"good","viewport":"mobile","state":"success","title":"check-in","primaryAction":"Mark complete","blocks":[{"kind":"status","label":"check-in","emphasis":3},{"kind":"action","label":"Mark complete","emphasis":2}],"appliedRuleIds":["typography.role-contrast","layout.action-evidence","responsive.recompose-not-stack","color.semantic-roles","state.complete-primary-flow","signature.product-data-grammar"],"violatedRuleIds":[],"asset":"assets/good-mobile-success.svg"},
    {"id":"bad-mobile-success","quality":"bad","viewport":"mobile","state":"success","title":"check-in","primaryAction":"Mark complete","blocks":[{"kind":"copy","label":"check-in","emphasis":1},{"kind":"action","label":"Mark complete","emphasis":1}],"appliedRuleIds":[],"violatedRuleIds":["responsive.mobile-thumb-zone","layout.action-evidence","typography.role-contrast"],"asset":"assets/bad-mobile-success.svg"},
    {"id":"good-mobile-loading","quality":"good","viewport":"mobile","state":"loading","title":"Loading","primaryAction":"Mark complete","blocks":[{"kind":"status","label":"Loading","emphasis":3},{"kind":"list","label":"check-in","emphasis":2}],"appliedRuleIds":["typography.role-contrast","layout.action-evidence","responsive.recompose-not-stack","color.semantic-roles","state.complete-primary-flow","signature.product-data-grammar"],"violatedRuleIds":[],"asset":"assets/good-mobile-loading.svg"},
    {"id":"bad-mobile-loading","quality":"bad","viewport":"mobile","state":"loading","title":"Loading","primaryAction":"Mark complete","blocks":[{"kind":"copy","label":"Loading","emphasis":1}],"appliedRuleIds":[],"violatedRuleIds":["state.complete-primary-flow","responsive.mobile-thumb-zone","typography.role-contrast"],"asset":"assets/bad-mobile-loading.svg"},
    {"id":"good-mobile-empty","quality":"good","viewport":"mobile","state":"empty","title":"Nothing here yet","primaryAction":"Mark complete","blocks":[{"kind":"heading","label":"Nothing here yet","emphasis":3},{"kind":"action","label":"Mark complete","emphasis":2}],"appliedRuleIds":["typography.role-contrast","layout.action-evidence","responsive.recompose-not-stack","color.semantic-roles","state.complete-primary-flow","signature.product-data-grammar"],"violatedRuleIds":[],"asset":"assets/good-mobile-empty.svg"},
    {"id":"bad-mobile-empty","quality":"bad","viewport":"mobile","state":"empty","title":"Nothing here yet","primaryAction":"Mark complete","blocks":[{"kind":"copy","label":"Nothing here yet","emphasis":1}],"appliedRuleIds":[],"violatedRuleIds":["state.complete-primary-flow","layout.action-evidence","responsive.mobile-thumb-zone"],"asset":"assets/bad-mobile-empty.svg"},
    {"id":"good-mobile-error","quality":"good","viewport":"mobile","state":"error","title":"Try again","primaryAction":"Try again","blocks":[{"kind":"status","label":"Offline","emphasis":3},{"kind":"action","label":"Try again","emphasis":2}],"appliedRuleIds":["typography.role-contrast","layout.action-evidence","responsive.recompose-not-stack","color.semantic-roles","state.complete-primary-flow","signature.product-data-grammar"],"violatedRuleIds":[],"asset":"assets/good-mobile-error.svg"},
    {"id":"bad-mobile-error","quality":"bad","viewport":"mobile","state":"error","title":"Try again","primaryAction":"Try again","blocks":[{"kind":"copy","label":"Offline","emphasis":1}],"appliedRuleIds":[],"violatedRuleIds":["state.optimistic-offline","color.operational-status","layout.action-evidence"],"asset":"assets/bad-mobile-error.svg"}
  ]
}
