{
  "schemaVersion": "1.0", "recipeId": "e-commerce", "productScenario": "Product comparison with availability and fulfillment",
  "differenceExplanation": ["Good hierarchy synchronizes variant → availability → price/cart summary; bad composition leaves the add action detached from the selected variant.", "Good states preserve the same variant through availability and recovery; bad states hide which product state failed.", "Good mobile scenes keep selection and cart consequences coherent; bad scenes show generic product copy."],
  "scenes": [
    {"id":"good-desktop-success","quality":"good","viewport":"desktop","state":"success","title":"product","primaryAction":"Add to cart","blocks":[{"kind":"media","label":"Selected variant","emphasis":3},{"kind":"status","label":"Available","emphasis":2},{"kind":"copy","label":"Price and cart summary","emphasis":2},{"kind":"action","label":"Add to cart","emphasis":2}],"appliedRuleIds":["typography.role-contrast","layout.action-evidence","responsive.recompose-not-stack","color.semantic-roles","state.complete-primary-flow","signature.product-data-grammar"],"violatedRuleIds":[],"asset":"assets/good-desktop-success.svg"},
    {"id":"bad-desktop-success","quality":"bad","viewport":"desktop","state":"success","title":"product","primaryAction":"Add to cart","blocks":[{"kind":"action","label":"Add to cart","emphasis":3},{"kind":"copy","label":"product","emphasis":1}],"appliedRuleIds":[],"violatedRuleIds":["typography.role-contrast","layout.commerce-comparison","signature.product-data-grammar"],"asset":"assets/bad-desktop-success.svg"},
    {"id":"good-mobile-success","quality":"good","viewport":"mobile","state":"success","title":"product","primaryAction":"Add to cart","blocks":[{"kind":"media","label":"Selected variant","emphasis":3},{"kind":"status","label":"Available","emphasis":2},{"kind":"copy","label":"Price and cart summary","emphasis":2},{"kind":"action","label":"Add to cart","emphasis":2}],"appliedRuleIds":["typography.role-contrast","layout.action-evidence","responsive.recompose-not-stack","color.semantic-roles","state.complete-primary-flow","signature.product-data-grammar"],"violatedRuleIds":[],"asset":"assets/good-mobile-success.svg"},
    {"id":"bad-mobile-success","quality":"bad","viewport":"mobile","state":"success","title":"product","primaryAction":"Add to cart","blocks":[{"kind":"copy","label":"product","emphasis":1},{"kind":"action","label":"Add to cart","emphasis":1}],"appliedRuleIds":[],"violatedRuleIds":["responsive.recompose-not-stack","layout.commerce-comparison","typography.role-contrast"],"asset":"assets/bad-mobile-success.svg"},
    {"id":"good-mobile-loading","quality":"good","viewport":"mobile","state":"loading","title":"Loading","primaryAction":"Add to cart","blocks":[{"kind":"status","label":"Loading","emphasis":3},{"kind":"media","label":"product","emphasis":2}],"appliedRuleIds":["typography.role-contrast","layout.action-evidence","responsive.recompose-not-stack","color.semantic-roles","state.complete-primary-flow","signature.product-data-grammar"],"violatedRuleIds":[],"asset":"assets/good-mobile-loading.svg"},
    {"id":"bad-mobile-loading","quality":"bad","viewport":"mobile","state":"loading","title":"Loading","primaryAction":"Add to cart","blocks":[{"kind":"copy","label":"Loading","emphasis":1}],"appliedRuleIds":[],"violatedRuleIds":["state.complete-primary-flow","layout.commerce-comparison","typography.role-contrast"],"asset":"assets/bad-mobile-loading.svg"},
    {"id":"good-mobile-empty","quality":"good","viewport":"mobile","state":"empty","title":"Nothing here yet","primaryAction":"Add to cart","blocks":[{"kind":"heading","label":"Nothing here yet","emphasis":3},{"kind":"action","label":"Add to cart","emphasis":2}],"appliedRuleIds":["typography.role-contrast","layout.action-evidence","responsive.recompose-not-stack","color.semantic-roles","state.complete-primary-flow","signature.product-data-grammar"],"violatedRuleIds":[],"asset":"assets/good-mobile-empty.svg"},
    {"id":"bad-mobile-empty","quality":"bad","viewport":"mobile","state":"empty","title":"Nothing here yet","primaryAction":"Add to cart","blocks":[{"kind":"copy","label":"Nothing here yet","emphasis":1}],"appliedRuleIds":[],"violatedRuleIds":["state.complete-primary-flow","layout.commerce-comparison","responsive.recompose-not-stack"],"asset":"assets/bad-mobile-empty.svg"},
    {"id":"good-mobile-error","quality":"good","viewport":"mobile","state":"error","title":"Try again","primaryAction":"Try again","blocks":[{"kind":"media","label":"Selected variant","emphasis":2},{"kind":"status","label":"Unavailable","emphasis":3},{"kind":"action","label":"Try again","emphasis":2}],"appliedRuleIds":["typography.role-contrast","layout.action-evidence","responsive.recompose-not-stack","color.semantic-roles","state.complete-primary-flow","signature.product-data-grammar"],"violatedRuleIds":[],"asset":"assets/good-mobile-error.svg"},
    {"id":"bad-mobile-error","quality":"bad","viewport":"mobile","state":"error","title":"Try again","primaryAction":"Try again","blocks":[{"kind":"copy","label":"Unavailable","emphasis":1}],"appliedRuleIds":[],"violatedRuleIds":["state.complete-primary-flow","color.commerce-trust","layout.commerce-comparison"],"asset":"assets/bad-mobile-error.svg"}
  ]
}
